[
  {
    "tech_id": "ashp_ductless",
    "display_name_en": "Ductless air-to-air heat pump",
    "display_name_zh": "无风管空气-空气热泵",
    "visibility": "internal",
    "role": "primary",
    "services": ["heating_and_cooling"],
    "catalog_status": "active",
    "ranking_mode": "standalone",
    "screening": {
      "installation_level": "minor",
      "outdoor_space_required": "wall_or_balcony",
      "permanent_modification_required": true,
      "onsite_combustion": false,
      "infrastructure_required": ["electricity"],
      "climate_rules": ["cold_performance_check"],
      "supported_building_types": ["detached", "semi_detached_or_row", "apartment", "other"],
      "requires_local_installer_confirmation": true
    },
    "baseline_mapping": { "heating_categories": ["heat_pump_unspecified"], "cooling_categories": ["heat_pump_cooling_unspecified", "room_ac_unspecified"] },
    "g4_defaults": { "capex_tier": 3, "operating_cost_model": "heat_pump_cop", "comfort_tier": 4, "simplicity_tier": 3, "carbon_model": "grid_electricity", "expected_lifetime_years": { "low": 10, "mid": 15, "high": 20 }, "maintenance_tier": "medium" },
    "path_rules": { "can_form_standalone_path": true, "can_form_bundle": true, "recommended_supporting_ids": ["insulation_air_sealing", "external_shading"], "max_paths_per_primary": 2 },
    "explanation": { "summary_en": "A room-by-room heat pump that can provide efficient heating and cooling without ducts.", "summary_zh": "一种无需风管的分室热泵，可提供较高效的取暖和制冷。", "confirmation_en": "Confirm cold-climate performance and outdoor-unit placement locally.", "confirmation_zh": "需要当地确认低温性能和室外机安装位置。" },
    "evidence": { "source_names": ["IEA heat pump guidance", "ENERGY STAR heat pump overview"], "source_urls": ["https://www.iea.org/reports/the-future-of-heat-pumps", "https://www.energystar.gov/products/heat_pumps"], "last_reviewed": "2026-08-06", "data_confidence": "high" }
  },
  {
    "tech_id": "ashp_ducted",
    "display_name_en": "Ducted air-source heat pump",
    "display_name_zh": "风管式空气源热泵",
    "visibility": "internal",
    "role": "primary",
    "services": ["heating_and_cooling"],
    "catalog_status": "active",
    "ranking_mode": "standalone",
    "screening": { "installation_level": "moderate", "outdoor_space_required": "wall_or_balcony", "permanent_modification_required": true, "onsite_combustion": false, "infrastructure_required": ["electricity"], "climate_rules": ["cold_performance_check"], "supported_building_types": ["detached", "semi_detached_or_row", "other"], "requires_local_installer_confirmation": true },
    "baseline_mapping": { "heating_categories": ["heat_pump_unspecified"], "cooling_categories": ["heat_pump_cooling_unspecified", "central_ac"] },
    "g4_defaults": { "capex_tier": 4, "operating_cost_model": "heat_pump_cop", "comfort_tier": 5, "simplicity_tier": 3, "carbon_model": "grid_electricity", "expected_lifetime_years": { "low": 10, "mid": 15, "high": 20 }, "maintenance_tier": "medium" },
    "path_rules": { "can_form_standalone_path": true, "can_form_bundle": true, "recommended_supporting_ids": ["insulation_air_sealing", "erv_hrv"], "max_paths_per_primary": 2 },
    "explanation": { "summary_en": "A whole-home ducted heat pump for heating and cooling when ducted distribution is feasible.", "summary_zh": "适合具备风管分配条件的全屋取暖与制冷热泵。", "confirmation_en": "Confirm ductwork and sizing with a local installer.", "confirmation_zh": "需要当地安装人员确认风管和容量。" },
    "evidence": { "source_names": ["IEA heat pump guidance", "ENERGY STAR heat pump overview"], "last_reviewed": "2026-08-06", "data_confidence": "high" }
  },
  {
    "tech_id": "ashp_air_to_water",
    "display_name_en": "Air-to-water heat pump",
    "display_name_zh": "空气-水热泵",
    "visibility": "internal",
    "role": "primary",
    "services": ["heating"],
    "catalog_status": "active",
    "ranking_mode": "standalone",
    "screening": { "installation_level": "moderate", "outdoor_space_required": "wall_or_balcony", "permanent_modification_required": true, "onsite_combustion": false, "infrastructure_required": ["electricity"], "climate_rules": ["cold_performance_check"], "supported_building_types": ["detached", "semi_detached_or_row", "apartment", "other"], "requires_local_installer_confirmation": true },
    "baseline_mapping": { "heating_categories": ["heat_pump_unspecified"], "cooling_categories": [] },
    "g4_defaults": { "capex_tier": 4, "operating_cost_model": "heat_pump_cop", "comfort_tier": 4, "simplicity_tier": 3, "carbon_model": "grid_electricity", "expected_lifetime_years": { "low": 12, "mid": 18, "high": 22 }, "maintenance_tier": "medium" },
    "path_rules": { "can_form_standalone_path": true, "can_form_bundle": true, "recommended_supporting_ids": ["insulation_air_sealing", "solar_thermal_heating"], "max_paths_per_primary": 2 },
    "explanation": { "summary_en": "A heat pump that supplies hot water for space heating systems.", "summary_zh": "为空间取暖系统提供热水的空气源热泵。", "confirmation_en": "Cooling service should only be added with local product data.", "confirmation_zh": "只有当地产品数据确认后才加入制冷服务。" },
    "evidence": { "source_names": ["IEA heat pump guidance"], "last_reviewed": "2026-08-06", "data_confidence": "medium" }
  },
  {
    "tech_id": "gshp",
    "display_name_en": "Ground-source heat pump",
    "display_name_zh": "地源热泵",
    "visibility": "internal",
    "role": "primary",
    "services": ["heating_and_cooling"],
    "catalog_status": "conditional",
    "ranking_mode": "standalone",
    "screening": { "installation_level": "major", "outdoor_space_required": "large_private_land", "permanent_modification_required": true, "onsite_combustion": false, "infrastructure_required": ["electricity", "ground_access"], "climate_rules": ["general"], "supported_building_types": ["detached", "semi_detached_or_row", "other"], "requires_local_installer_confirmation": true },
    "baseline_mapping": { "heating_categories": ["heat_pump_unspecified"], "cooling_categories": ["heat_pump_cooling_unspecified"] },
    "g4_defaults": { "capex_tier": 5, "operating_cost_model": "heat_pump_cop", "comfort_tier": 5, "simplicity_tier": 2, "carbon_model": "grid_electricity", "expected_lifetime_years": { "low": 18, "mid": 25, "high": 35 }, "maintenance_tier": "medium" },
    "path_rules": { "can_form_standalone_path": true, "can_form_bundle": true, "recommended_supporting_ids": ["insulation_air_sealing"], "max_paths_per_primary": 2 },
    "explanation": { "summary_en": "A high-efficiency heat pump using ground heat exchange, usually requiring significant land or drilling.", "summary_zh": "利用地下换热的高效热泵，通常需要较大土地或钻井条件。", "confirmation_en": "Ground access, drilling rules, and local cost must be confirmed.", "confirmation_zh": "需确认地面条件、钻井规定和当地成本。" },
    "evidence": { "source_names": ["US DOE geothermal heat pumps"], "source_urls": ["https://www.energy.gov/energysaver/geothermal-heat-pumps"], "last_reviewed": "2026-08-06", "data_confidence": "medium" }
  },
  {
    "tech_id": "water_source_hp",
    "display_name_en": "Water-source heat pump",
    "display_name_zh": "水源热泵",
    "visibility": "internal",
    "role": "primary",
    "services": ["heating_and_cooling"],
    "catalog_status": "phase2",
    "ranking_mode": "phase2",
    "screening": { "installation_level": "major", "outdoor_space_required": "small_yard_or_roof", "permanent_modification_required": true, "onsite_combustion": false, "infrastructure_required": ["electricity", "usable_heat_source"], "climate_rules": ["general"], "requires_region_confirmation": true, "requires_local_installer_confirmation": true },
    "baseline_mapping": { "heating_categories": ["heat_pump_unspecified"], "cooling_categories": ["heat_pump_cooling_unspecified"] },
    "g4_defaults": { "capex_tier": 5, "operating_cost_model": "heat_pump_cop", "comfort_tier": 5, "simplicity_tier": 2, "carbon_model": "grid_electricity", "expected_lifetime_years": { "low": 15, "mid": 22, "high": 30 }, "maintenance_tier": "high" },
    "path_rules": { "can_form_standalone_path": false, "can_form_bundle": false, "max_paths_per_primary": 0 },
    "explanation": { "summary_en": "A water-source heat pump for future regions with usable shared or natural heat sources.", "summary_zh": "适用于未来具备可用水源或共享热源地区的水源热泵。" },
    "evidence": { "source_names": ["ASHRAE water-source heat pump references"], "last_reviewed": "2026-08-06", "data_confidence": "low" }
  },
  {
    "tech_id": "hybrid_hp_boiler",
    "display_name_en": "Hybrid heat pump and boiler",
    "display_name_zh": "热泵与锅炉混合系统",
    "visibility": "internal",
    "role": "primary",
    "services": ["heating_and_cooling"],
    "catalog_status": "conditional",
    "ranking_mode": "standalone",
    "screening": { "installation_level": "moderate", "outdoor_space_required": "wall_or_balcony", "permanent_modification_required": true, "onsite_combustion": true, "infrastructure_required": ["electricity", "piped_gas"], "climate_rules": ["cold_performance_check"], "supported_building_types": ["detached", "semi_detached_or_row", "other"], "requires_region_confirmation": true, "requires_local_installer_confirmation": true },
    "baseline_mapping": { "heating_categories": ["heat_pump_unspecified", "gas_heating_unspecified", "delivered_fuel_heating_unspecified"], "cooling_categories": ["heat_pump_cooling_unspecified"] },
    "g4_defaults": { "capex_tier": 4, "operating_cost_model": "hybrid_dispatch", "comfort_tier": 5, "simplicity_tier": 2, "carbon_model": "hybrid_weighted", "expected_lifetime_years": { "low": 10, "mid": 15, "high": 20 }, "maintenance_tier": "high" },
    "path_rules": { "can_form_standalone_path": true, "can_form_bundle": true, "recommended_supporting_ids": ["insulation_air_sealing"], "max_paths_per_primary": 2 },